{"cycles":[{"cycle":1,"distinct_findings":1,"fix_keys":[],"review_attempt_id":"attempt-1"}],"findings":{"finding-1":{"category":"correctness","contract_violation":false,"cycles_seen":[1,2],"evidence_refs":[],"file":"harness_labs/example.py","fix_attempts":[{"cycle":1,"outcome":"reopened"}],"fix_cost":"local","key":"finding-1","occurrences":2,"outcome":"fixed","protects":"runtime correctness","reopened_count":1,"requires_disposition":true,"scope_expanding":false,"score":60,"severity":"major","source_finding_ids":["finding-1"],"statement":"Synthetic reopened finding for a fabricated fixture run.","subject":"synthetic finding"}},"policy":{},"protocol":"review-ledger/1","risk_tier":"mechanical"}
