{"cycles":[{"cycle":1,"distinct_findings":2,"fix_keys":[],"review_attempt_id":"attempt-1"}],"findings":{"finding-1":{"category":"correctness","contract_violation":false,"cycles_seen":[1,2],"evidence_refs":[],"file":"harness_labs/example.py","fix_attempts":[{"cycle":1,"outcome":"reopened"}],"fix_cost":"local","key":"finding-1","occurrences":2,"outcome":"fixed","protects":"runtime correctness","reopened_count":1,"requires_disposition":true,"scope_expanding":false,"score":60,"severity":"major","source_finding_ids":["finding-1"],"statement":"Validation missing on retry path.","subject":"widget validation"},"finding-2":{"category":"style","contract_violation":false,"cycles_seen":[1],"evidence_refs":[],"file":"harness_labs/example.py","fix_attempts":[],"fix_cost":"one-line","key":"finding-2","occurrences":1,"outcome":"fixed","protects":"readability","reopened_count":0,"requires_disposition":false,"scope_expanding":false,"score":5,"severity":"info","source_finding_ids":["finding-2"],"statement":"Minor style issue, never reopened.","subject":"unrelated style nit"}},"policy":{},"protocol":"review-ledger/1","risk_tier":"mechanical"}
